{
  "schema_version": "1.0.0",
  "stage": "review_lesson_agent",
  "lesson_id": "9-11차시",
  "status": "succeeded",
  "decision": "pass",
  "findings": [
    {
      "severity": "info",
      "message": "추출된 텍스트(72-81쪽)를 바탕으로 이야기 읽기, 가치 탐구, 글쓰기 활동의 3단계 흐름으로 분석을 정교화함.",
      "evidence_refs": []
    }
  ],
  "blocking_issues": [],
  "warnings": []
}
