{
  "schema_version": "1.0.0",
  "stage": "review_lesson_agent",
  "lesson_id": "4-6차시",
  "status": "succeeded",
  "decision": "pass",
  "findings": [
    {
      "severity": "info",
      "message": "텍스트북의 '책 깎는 소년' 이야기를 중심으로 시대적 배경(목판 인쇄)과 인물의 가치관 차이(장호 vs 봉운)를 명확히 분석함. PDF 페이지 15-26이 교과서 48-59쪽과 정확히 일치함.",
      "evidence_refs": []
    }
  ],
  "blocking_issues": [],
  "warnings": []
}
