{
  "schema_version": "1.0.0",
  "stage": "review_lesson_agent",
  "lesson_id": "2-3차시",
  "status": "succeeded",
  "decision": "pass",
  "findings": [
    {
      "severity": "info",
      "message": "전기문 '의병장 윤희순'을 텍스트로 하여 인물의 가치 파악 방법을 익히는 차시입니다. 시대 상황(국권 침탈기)과 여성으로서의 적극적인 활동을 연결하는 것이 분석의 핵심입니다.",
      "evidence_refs": []
    }
  ],
  "blocking_issues": [],
  "warnings": []
}
